{
  "ruleId": "1234",
  "accountId": "1234abcd",
  "priority": 1,
  "rule": {
    "filters": {
      "fromAddress": [
        "abcd",
        "yes",
        "no"
      ],
      "words": [
        "yello",
        "no"
      ],
      "links": [
        "a.com",
        "b.com"
      ],
      "tags": {
        "categories": [
          "gaming",
          "etc"
        ],
        "subjects": [
          ""
        ],
        "sentiment": [
          ""
        ],
        "buzzwords": [
          ""
        ],
        "summary": [
          ""
        ]
      }
    },
    "actions": {
      "delete": false,
      "copy": false,
      "moveTo": [
        "firma"
      ],
      "forward": [
        "a@b"
      ],
      "encryption": {
        "encrypt": true,
        "method": [
          "subject",
          "subject_and_body",
          "body",
          "from"
        ]
      }
    }
  }
}